{
  "event_sequence": 2,
  "execution_id": "chatgpt-windows-smoke-harness-write-20260828T2019Z",
  "progress": 100.0,
  "schema": "zero3.commander.state/2.0",
  "source": "publisher",
  "stage": "file.write",
  "state": "succeeded",
  "task_id": "pilot-task-7e0539c0d25d4e09",
  "terminal": true,
  "updated_at": "2026-08-28T20:19:36Z"
}
