{
  "event_sequence": 2,
  "execution_id": "chatgpt-weixin-windows-persist-20260828T2114Z",
  "progress": 0.0,
  "schema": "zero3.commander.state/2.0",
  "source": "publisher",
  "stage": "file.patch",
  "state": "failed",
  "task_id": "pilot-task-85e852204ce64774",
  "terminal": true,
  "updated_at": "2026-08-28T21:14:00Z"
}
