{
  "event_sequence": 3,
  "execution_id": "chatgpt-ocu-refresh4-20260828T1843Z",
  "progress": 100.0,
  "schema": "zero3.commander.state/2.0",
  "source": "publisher",
  "stage": "repo.checkout",
  "state": "succeeded",
  "task_id": "pilot-task-0c7ccdf08a0a4bdf",
  "terminal": true,
  "updated_at": "2026-08-28T18:41:19Z"
}
