{
  "event_sequence": 3,
  "execution_id": "chatgpt-computer-serde-fix-20260828T2010Z",
  "progress": 100.0,
  "schema": "zero3.commander.state/2.0",
  "source": "publisher",
  "stage": "file.patch",
  "state": "succeeded",
  "task_id": "pilot-task-692dbe923f174a40",
  "terminal": true,
  "updated_at": "2026-08-28T20:01:06Z"
}
