{
  "event_sequence": 1,
  "execution_id": "chatgpt-installer-weixin-build2-20260828T2111Z",
  "progress": 0.0,
  "schema": "zero3.commander.state/2.0",
  "source": "publisher",
  "stage": "test.build",
  "state": "running",
  "task_id": "pilot-task-f9947edd87324e82",
  "terminal": false,
  "updated_at": "2026-08-28T21:11:30Z"
}
