{
  "event_sequence": 3,
  "execution_id": "chatgpt-final-fmt-20260828T2022Z",
  "progress": 100.0,
  "schema": "zero3.commander.state/2.0",
  "source": "publisher",
  "stage": "test.fmt",
  "state": "succeeded",
  "task_id": "pilot-task-9b15f35a813e45ac",
  "terminal": true,
  "updated_at": "2026-08-28T20:22:28Z"
}
