{
  "event_sequence": 3,
  "execution_id": "chatgpt-weixin-format-run-20260828T2122Z",
  "progress": 100.0,
  "schema": "zero3.commander.state/2.0",
  "source": "publisher",
  "stage": "test.run",
  "state": "succeeded",
  "task_id": "pilot-task-8b90f4eaf9ca4e84",
  "terminal": true,
  "updated_at": "2026-08-28T21:22:11Z"
}
