{
  "event_sequence": 2,
  "execution_id": "chatgpt-router-node-clean-imports2-20260829T0221Z",
  "progress": 0.0,
  "schema": "zero3.commander.state/2.0",
  "source": "publisher",
  "stage": "file.patch",
  "state": "failed",
  "task_id": "pilot-task-bcc0bab9f03443d5",
  "terminal": true,
  "updated_at": "2026-08-29T02:13:29Z"
}
