{
  "event_sequence": 3,
  "execution_id": "chatgpt-router-node-module-20260829T0140Z",
  "progress": 100.0,
  "schema": "zero3.commander.state/2.0",
  "source": "publisher",
  "stage": "file.patch",
  "state": "succeeded",
  "task_id": "pilot-task-deb86f230b8a4efe",
  "terminal": true,
  "updated_at": "2026-08-29T01:40:19Z"
}
