{
  "event_sequence": 3,
  "execution_id": "chatgpt-weixin-windows-persist2-20260828T2115Z",
  "progress": 100.0,
  "schema": "zero3.commander.state/2.0",
  "source": "publisher",
  "stage": "file.patch",
  "state": "succeeded",
  "task_id": "pilot-task-d05cc6efc3ef4c50",
  "terminal": true,
  "updated_at": "2026-08-28T21:16:10Z"
}
