{
  "event_sequence": 2,
  "execution_id": "chatgpt-router-ui-agent-select-20260829T0232Z",
  "progress": 0.0,
  "schema": "zero3.commander.state/2.0",
  "source": "publisher",
  "stage": "file.patch",
  "state": "failed",
  "task_id": "pilot-task-9dc1420e72cb4315",
  "terminal": true,
  "updated_at": "2026-08-29T02:19:26Z"
}
