{
  "event_sequence": 1,
  "execution_id": "chatgpt-weixin-summary-push2-20260829T0040Z",
  "progress": 0.0,
  "schema": "zero3.commander.state/2.0",
  "source": "publisher",
  "stage": "git.push_branch",
  "state": "running",
  "task_id": "pilot-task-12c28b1626f34a5e",
  "terminal": false,
  "updated_at": "2026-08-29T00:39:50Z"
}
