{
  "event_sequence": 2,
  "execution_id": "chatgpt-weixin-formatter-harness-20260828T2122Z",
  "progress": 100.0,
  "schema": "zero3.commander.state/2.0",
  "source": "publisher",
  "stage": "file.write",
  "state": "succeeded",
  "task_id": "pilot-task-77433c025ada4e35",
  "terminal": true,
  "updated_at": "2026-08-28T21:21:31Z"
}
