{
  "event_sequence": 3,
  "execution_id": "chatgpt-router-skill-clean-import-20260829T0214Z",
  "progress": 100.0,
  "schema": "zero3.commander.state/2.0",
  "source": "publisher",
  "stage": "file.patch",
  "state": "succeeded",
  "task_id": "pilot-task-56e572fe001c4107",
  "terminal": true,
  "updated_at": "2026-08-29T02:09:52Z"
}
