{
  "event_sequence": 2,
  "execution_id": "chatgpt-autonomy-write-canary-20260828T1632Z",
  "progress": 100.0,
  "schema": "zero3.commander.state/2.0",
  "source": "publisher",
  "stage": "file.write",
  "state": "succeeded",
  "task_id": "pilot-task-e4f0e8594f0b4383",
  "terminal": true,
  "updated_at": "2026-08-28T16:31:12Z"
}
