{
  "event_sequence": 1,
  "execution_id": "chatgpt-router-skills-build3-20260829T0231Z",
  "progress": 0.0,
  "schema": "zero3.commander.state/2.0",
  "source": "publisher",
  "stage": "test.build",
  "state": "running",
  "task_id": "pilot-task-696c8dcc26c246e9",
  "terminal": false,
  "updated_at": "2026-08-29T02:18:45Z"
}
