{
  "event_sequence": 2,
  "execution_id": "chatgpt-weixin-hardening-patch-20260828T2113Z",
  "progress": 0.0,
  "schema": "zero3.commander.state/2.0",
  "source": "publisher",
  "stage": "file.patch",
  "state": "failed",
  "task_id": "pilot-task-3a3ff7035d0b4543",
  "terminal": true,
  "updated_at": "2026-08-28T21:13:04Z"
}
