{
  "event_sequence": 1,
  "execution_id": "chatgpt-node-build2-20260828T1955Z",
  "progress": 0.0,
  "schema": "zero3.commander.state/2.0",
  "source": "publisher",
  "stage": "test.build",
  "state": "running",
  "task_id": "pilot-task-3c4ee15f699141d5",
  "terminal": false,
  "updated_at": "2026-08-28T19:51:44Z"
}
