{
  "event_sequence": 3,
  "execution_id": "chatgpt-router-wip-status-20260829T0216Z",
  "progress": 100.0,
  "schema": "zero3.commander.state/2.0",
  "source": "publisher",
  "stage": "repo.status",
  "state": "succeeded",
  "task_id": "pilot-task-3bfed6d9a025407a",
  "terminal": true,
  "updated_at": "2026-08-29T02:10:50Z"
}
