{
  "event_sequence": 3,
  "execution_id": "chatgpt-node-clippy1-20260828T2005Z",
  "progress": 100.0,
  "schema": "zero3.commander.state/2.0",
  "source": "publisher",
  "stage": "test.clippy",
  "state": "succeeded",
  "task_id": "pilot-task-fcf12f85de284474",
  "terminal": true,
  "updated_at": "2026-08-28T19:57:15Z"
}
